<?xml version="1.0" encoding="UTF-8"?>
<eventabstraction xmlns="http://fittest.eu/eventabstraction"
	xmlns:xsi="http://www.w3.org/2001/XMLSchema-instance"
	xsi:schemaLocation="http://fittest.eu/eventabstraction eventabstraction.xsd ">
	<rewrites>
		<rule>
			<match>/workgroup/public/([a-z]+)/([a-z]+)/id/([0-9]+)</match>
			<replace>/workgroup/public/$1?action=$2&amp;id=$3</replace>
		</rule>
		<rule>
			<match>/workgroup/public/([a-z]+)/([a-z]+)</match>
			<replace>/workgroup/public/$1?action=$2</replace>
		</rule>
	</rewrites>
	<abstractions>
		<abstraction variable="id" function="ZeroNonZero" />
		<abstraction variable="action" function="EmptyNonEmpty" />

		<path path="/workgroup/public/projectdata">
			<abstraction variable="action" function="Regexp">
				<param name="user" value="adduser|deleteuser" />
				<param name="other" value=".*" />
			</abstraction>
		</path>
		<path path="/workgroup/public/login">
			<abstraction variable="userid" function="EmptyNonEmpty" />

			<abstraction variable="password" function="Ignore" />
		</path>

	</abstractions>
</eventabstraction>
